timestamp,rank,original_name,search_term,exact_match,match_count,top_matches
2026-02-16 07:27:43 UTC,193,GLY CONSTRUCTION,GLY CONSTRUCTION,True,34654,GLY Construction; Project Management and Coordination; HTF CONSTRUCTION CONSTRUCTION
2026-02-16 07:27:43 UTC,194,ARCH-CON CORP.,ARCH-CON,True,15,Archeton LLC; Design and Engineering; Archeon Group
2026-02-16 07:27:43 UTC,195,LAS VEGAS PAVING CORP.,LAS VEGAS PAVING,True,5718,Las Vegas Paving; Concrete; Earthwork
2026-02-16 07:27:43 UTC,196,STAKER PARSON MATERIALS & CONSTRUCTION,STAKER PARSON MATERIALS & CONSTRUCTION,False,1742,Staker Parson Companies; Earthwork; office
2026-02-16 07:27:43 UTC,197,POGUE CONSTRUCTION CO. LP,POGUE CONSTRUCTION,False,34656,Pogue Electric Service Inc.; Electrical; HTF CONSTRUCTION CONSTRUCTION
2026-02-16 07:27:43 UTC,198,HAWAIIAN DREDGING CONSTRUCTION CO. INC.,HAWAIIAN DREDGING CONSTRUCTION,True,34678,Hawaiian Dredging Construction Company; Construction Scheduling; Crosby Dredging
2026-02-16 07:27:43 UTC,199,CALLAHAN INC.,CALLAHAN,True,54,office; Callahan Inc; Project Management and Coordination
2026-02-16 07:27:43 UTC,200,ZACHRY CONSTRUCTION CORP.,ZACHRY CONSTRUCTION,True,34660,Zachry Construction Corporation; Concrete; Demolition
2026-02-16 07:27:43 UTC,201,GRAYCOR,GRAYCOR,True,208,Graycor; Concrete; Demolition
2026-02-16 07:27:43 UTC,202,GE JOHNSON,GE JOHNSON,False,1012,Project Management and Coordination; Electrical; Design and Engineering
2026-02-16 07:27:43 UTC,203,C.W. DRIVER COS.,C.W. DRIVER,False,4592,C & W; Masonry; Project Management and Coordination
2026-02-16 07:27:43 UTC,204,MYCON GENERAL CONTRACTORS INC.,MYCON GENERAL,False,5037,Mycon; Communications; Concrete
2026-02-16 07:27:43 UTC,205,MASCARO CONSTRUCTION CO. LP,MASCARO CONSTRUCTION,True,34654,Mascaro Construction; Ceilings; Concrete
2026-02-16 07:27:43 UTC,206,PARKWAY C&A,PARKWAY C&A,True,1357,Parkway; General Construction Management; Parkway electric
2026-02-16 07:27:43 UTC,207,DOME CONSTRUCTION,DOME CONSTRUCTION,False,34662,Dome Technology; Project Management and Coordination; Dome Engineering Group
2026-02-16 07:27:43 UTC,208,SKYLINE CONSTRUCTION,SKYLINE CONSTRUCTION,True,34816,Skyline Construction; General Construction Management; Project Management
2026-02-16 07:27:43 UTC,209,ELFORD INC.,ELFORD,False,422,Alford Group; Access Doors and Panels; Access Flooring
2026-02-16 07:27:43 UTC,210,DIMEO CONSTRUCTION CO.,DIMEO CONSTRUCTION,False,34655,HTF CONSTRUCTION CONSTRUCTION; Concrete; Rough Carpentry
2026-02-16 07:27:43 UTC,211,SLETTEN COS.,SLETTEN,True,30,Sletten Construction; Design and Engineering; Rudolph & Sletten
2026-02-16 07:27:43 UTC,212,DEACON CONSTRUCTION LLC,DEACON CONSTRUCTION,True,34657,"Deacon Construction, LLC; General Construction Management; Project Management and Coordination"
2026-02-16 07:27:43 UTC,213,IOVINO ENTERPRISES,IOVINO ENTERPRISES,False,3626,"Arcari & Iovino Architects; Architectural Design and Engineering; iovino design group, LLC"
2026-02-16 07:27:43 UTC,214,J.P. CULLEN AND SONS INC.,J.P. CULLEN AND SONS,True,1,"J.p. Cullen & Sons, Inc.; Concrete; Masonry"
2026-02-16 07:27:43 UTC,215,INDEPENDENCE CONSTRUCTION,INDEPENDENCE CONSTRUCTION,True,34694,Independence Construction; General Construction Management; Independence Construction LLC
2026-02-16 07:27:43 UTC,216,BBL CONSTRUCTION SERVICES LLC,BBL CONSTRUCTION,True,34658,"BBL Construction Services, LLC; BBL Carlton, LLC - Albany; BBL Carlton, LLC - West Virginia"
2026-02-16 07:27:43 UTC,217,COMMODORE BUILDERS,COMMODORE,True,3,Commodore; Concrete; Masonry
2026-02-16 07:27:43 UTC,218,MW BUILDERS,MW BUILDERS,True,4157,MW Builders; Structural Steel; Project Management and Coordination
2026-02-16 07:27:43 UTC,219,RIDGEMONT COMMERCIAL CO.,RIDGEMONT COMMERCIAL,False,9097,Central Homes Roofing and Solar; Roofing; Commercial
2026-02-16 07:27:43 UTC,220,WALSH CONSTRUCTION CO.,WALSH CONSTRUCTION,True,34723,Walsh; Concrete; Communications
2026-02-16 07:27:43 UTC,221,VECELLIO GROUP INC.,VECELLIO GROUP,False,9454,"Sharpe Brothers, a Division of Vecellio and Grogan; Concrete; Hal Jones Contractor-A Division of Vecellio & Grogan, Inc."
2026-02-16 07:27:43 UTC,222,MILENDER WHITE,MILENDER WHITE,False,1138,White Cap; Concrete; Masonry
2026-02-16 07:27:43 UTC,223,LEMOINE,LEMOINE,True,41,The Lemoine Company; Project Management and Coordination; Lemoine Program Services
2026-02-16 07:27:43 UTC,224,PARSONS CORP.,PARSONS,True,413,Parsons; Design and Engineering; Environmental Assessment
2026-02-16 07:27:43 UTC,225,CHINA CONSTR. AMERICA/PLAZA CONSTR.,CHINA CONSTRUCTION AMERICA,False,31632,China state construction and engineering; Concrete; Demolition
2026-02-16 07:27:43 UTC,226,PIKE CONSTRUCTION SERVICES INC.,PIKE CONSTRUCTION,True,34676,Pike Construction Inc.; Veteran Business Enterprise; Project Management and Coordination
2026-02-16 07:27:43 UTC,227,THE MIDDLESEX CORP.,MIDDLESEX,True,29,Middlesex Glass; Rough Carpentry; Middlesex School
2026-02-16 07:27:43 UTC,228,KAUFMAN LYNN CONSTRUCTION,KAUFMAN LYNN CONSTRUCTION,True,34694,Kaufman Lynn; Design and Engineering; Kaufman Dolowich
2026-02-16 07:27:43 UTC,229,RAND CONSTRUCTION CORP.,RAND CONSTRUCTION,True,34688,Rand Construction; Communications; Concrete
2026-02-16 07:27:43 UTC,230,PENNTEX CONSTRUCTION,PENNTEX CONSTRUCTION,False,34655,"PennTex Ventures, LLC; Communications; Concrete"
2026-02-16 07:27:43 UTC,231,BOH BROS. CONSTRUCTION CO. LLC,BOH BROS. CONSTRUCTION,True,34903,"Boh Bros. Construction Co., L.L.C.; Boh Bros. Construction Co., L.L.C ( Headquarters-New Orleans); Broadmoor LLC and Legacy Professional Services LLC, a Joint Venture"
2026-02-16 07:27:43 UTC,232,HOLT CONSTRUCTION,HOLT CONSTRUCTION,True,34687,Holt; Design and Engineering; Holt Construction Company
2026-02-16 07:27:43 UTC,233,EDIFICE INC.,EDIFICE,True,14,Edifice Expert; Building Information Modeling Bim; Edifice Construction
2026-02-16 07:27:43 UTC,234,R&O CONSTRUCTION,R&O CONSTRUCTION,False,1330,R & R FABRICATION; Small Business; Facility Maintenance and Operation Equipment
2026-02-16 07:27:43 UTC,235,ELECTRICAL CONSULTANTS INC.,ELECTRICAL CONSULTANTS,True,7406,Electrical Consultants Inc; Electrical; Electrical Design and Engineering
2026-02-16 07:27:43 UTC,236,W. M. JORDAN CO.,W. M. JORDAN,False,2402,Disadvantaged Business; Minority Business Enterprise; Union Member
2026-02-16 07:27:43 UTC,237,BERNARDS,BERNARDS,True,87,Bernards; Design and Engineering; Heating Ventilating and Air Conditioning HVAC
2026-02-16 07:27:43 UTC,238,ARISTEO CONSTRUCTION CO.,ARISTEO CONSTRUCTION,False,34654,Aristeo Garcia Construction LLC.; Concrete; Demolition
2026-02-16 07:27:43 UTC,239,NEW SOUTH CONSTRUCTION CO.,NEW SOUTH CONSTRUCTION,True,37846,New South Construction; Design and Engineering; Colony Hardware
2026-02-16 07:27:43 UTC,240,EMJ CONSTRUCTION,EMJ CONSTRUCTION,True,34660,EMJ Construction ionc; EMJ Construction inc; Project Management and Coordination
2026-02-16 07:27:43 UTC,241,GRANGER CONSTRUCTION CO.,GRANGER CONSTRUCTION,True,34662,Granger Construction Co. HQ; Columbus; Grand Rapids
2026-02-16 07:27:43 UTC,242,CHASSE BUILDING TEAM,CHASSE BUILDING TEAM,False,8295,Victory Building Team; Project Management and Coordination; Beseler Building Team
2026-02-16 07:27:43 UTC,243,IDEAL CONTRACTING LLC,IDEAL CONTRACTING,True,7036,office; Ideal Contracting; Concrete
2026-02-16 07:27:43 UTC,244,GRUNLEY CONSTRUCTION CO. INC.,GRUNLEY CONSTRUCTION,False,34655,HTF CONSTRUCTION CONSTRUCTION; Concrete; Rough Carpentry
2026-02-16 07:27:43 UTC,245,ANDRES CONSTRUCTION SERVICES LLC,ANDRES CONSTRUCTION,True,34660,Andres Construction; Project Management and Coordination; Andres Contracting LLC
2026-02-16 07:27:43 UTC,246,NAN INC.,NAN INC,True,113232,Nan Inc.; Concrete; Earthwork
2026-02-16 07:27:43 UTC,247,BRANCH GROUP,BRANCH GROUP,True,9623,Branch Groupe; Design and Engineering; Earthwork
2026-02-16 07:27:43 UTC,248,IMC CONSTRUCTION,IMC CONSTRUCTION,True,34665,IMC; Concrete; Electrical
2026-02-16 07:27:43 UTC,249,CARROLL DANIEL CONSTRUCTION CO.,CARROLL DANIEL CONSTRUCTION,True,34833,Carroll Daniel Construction Company; Carroll Daniel Construction Company - Atlanta; Carroll Daniel Construction Company - Greenville
2026-02-16 07:27:43 UTC,250,ENTACT,ENTACT,True,789,ENTACT; Construction Waste Management and Disposal; ENTACT LLC
2026-02-16 07:27:43 UTC,251,CSI CONSTRUCTION CO.,CSI CONSTRUCTION,True,34710,CSI Construction; General Construction Management; Project Management and Coordination
2026-02-16 07:27:43 UTC,252,HARKINS BUILDERS,HARKINS,True,1195,Harkins inc; Timber Framed Entrances and Storefronts; Hawkins
2026-02-16 07:27:43 UTC,253,O&G INDUSTRIES INC.,O&G INDUSTRIES,False,178,W O Grubb; HVAC General; Material Storage
2026-02-16 07:27:43 UTC,254,J. FLETCHER CREAMER & SON INC.,J. FLETCHER CREAMER,False,3019,
2026-02-16 07:27:43 UTC,255,CONTEGRA CONSTRUCTION CO.,CONTEGRA CONSTRUCTION,False,34654,HTF CONSTRUCTION CONSTRUCTION; Concrete; Rough Carpentry
2026-02-16 07:27:43 UTC,256,ALLIED POWER,ALLIED POWER,False,2511,Allied Glass; Project Management and Coordination; Allied Concrete
2026-02-16 07:27:43 UTC,257,CROWDER CONSTRUCTORS INC.,CROWDER CONSTRUCTORS,False,5432,Crowder Construction; Concrete; Earthwork
2026-02-16 07:27:43 UTC,258,SECURITY PAVING CO. INC.,SECURITY PAVING,False,7840,"Pavion Corporation; Electronic Security; Enterprise Security Solutions, a Pavion Company"
2026-02-16 07:27:43 UTC,259,MWH,MWH,True,255,MWH Constructors; Design and Engineering; Project Management and Coordination
2026-02-16 07:27:43 UTC,260,THE KORTE CO.,KORTE,False,61,Forte; Design and Engineering; Project Management and Coordination
2026-02-16 07:27:43 UTC,261,JUNEAU CONSTRUCTION CO.,JUNEAU CONSTRUCTION,True,34660,Juneau Construction Company; General Construction Management; Juneau Odenwald Inc
2026-02-16 07:27:43 UTC,262,PC CONSTRUCTION CO.,PC CONSTRUCTION,False,35020,Pc Posada construction; Concrete; Concrete Finishing
2026-02-16 07:27:43 UTC,263,URBAN ATELIER GROUP,URBAN ATELIER,True,381,Urban Atelier Group; Project Management and Coordination; V3 Atelier
2026-02-16 07:27:43 UTC,264,WIELAND,WIELAND,True,688,Corporate Office; Florida Office; Louisiana Office
2026-02-16 07:27:43 UTC,265,BULLEY & ANDREWS,BULLEY & ANDREWS,True,2672,Bulley & Andrews; Concrete; Masonry
2026-02-16 07:27:43 UTC,266,DICK ANDERSON CONSTRUCTION INC.,DICK ANDERSON CONSTRUCTION,True,35005,Billings Office; Bozeman Office; Chanen Construction Main Office
2026-02-16 07:27:43 UTC,267,LYLES CONSTRUCTION GROUP,LYLES CONSTRUCTION,False,34662,Perfect Cleaning ;  Nicole Lyles; Cleaning and Maintenance Of Existing Period Conditions
2026-02-16 07:27:43 UTC,268,SHIEL SEXTON CO. INC.,SHIEL SEXTON,False,799,sexton industrial; Project Management and Coordination; Shonna Sexton Studio
2026-02-16 07:27:43 UTC,269,ROCKFORD CONSTRUCTION CO.,ROCKFORD CONSTRUCTION,True,34677,Rockford Construction; General Construction Management; McCoy Rockford
2026-02-16 07:27:43 UTC,270,SUKUT CONSTRUCTION LLC,SUKUT CONSTRUCTION,True,34654,Sukut Construction LLC; Concrete; Demolition
2026-02-16 07:27:43 UTC,271,NEXAMP,NEXAMP,True,33,Nexamp; Electrical; Project Management and Coordination
2026-02-16 07:27:43 UTC,272,WOHLSEN CONSTRUCTION CO.,WOHLSEN CONSTRUCTION,True,34654,Wohlsen Construction Company Corporate; Connecticut; Greater Philadelphia
2026-02-16 07:27:43 UTC,273,FAGEN INC.,FAGEN,False,34,michael fagan; Acoustic Ceilings; Architectural Wood Casework
2026-02-16 07:27:43 UTC,274,CURRENT BUILDERS,CURRENT BUILDERS,False,4318,Current Electric; Electrical; Electrical General
2026-02-16 07:27:43 UTC,275,HASELDEN CONSTRUCTION,HASELDEN CONSTRUCTION,False,34654,HTF CONSTRUCTION CONSTRUCTION; Concrete; Rough Carpentry
2026-02-16 07:27:43 UTC,276,CDM SMITH,CDM SMITH,True,746,CDM Smith; Project Management and Coordination; Design and Engineering
2026-02-16 07:27:43 UTC,277,SEMA CONSTRUCTION INC.,SEMA CONSTRUCTION,True,34658,sema; Concrete; Sema Construction
2026-02-16 07:27:43 UTC,278,RUSSELL GROUP INC.,RUSSELL GROUP,False,9578,"office; Russell & Russell Construction, LLC; Ceilings"
2026-02-16 07:27:43 UTC,279,CAHILL CONTRACTORS,CAHILL CONTRACTORS,True,11059,Cahill Contractors; Project Management and Coordination; Cahill Contractors 
2026-02-16 07:27:43 UTC,280,DRYMALLA CONSTRUCTION CO.,DRYMALLA CONSTRUCTION,True,34654,Drymalla Construction; Project Management and Coordination; HTF CONSTRUCTION CONSTRUCTION
2026-02-16 07:27:43 UTC,281,FRANK L. BLUM CONSTRUCTION CO.,FRANK L. BLUM CONSTRUCTION,True,35559,Frank L Blum Construction; Project Management and Coordination; R L Blum Construction
2026-02-16 07:27:43 UTC,282,CAJUN INDUSTRIES HOLDINGS LLC,CAJUN INDUSTRIES,True,5409,Cajun Industries; Concrete; Razzoo's Cajun Cafe
2026-02-16 07:27:43 UTC,283,DANIS,DANIS,True,486,"Danis; Project Management and Coordination; Davis & Davis Interior Design Co., LLC"
2026-02-16 07:27:43 UTC,284,NIBBI BROS. ASSOCIATES INC.,NIBBI BROS. ASSOCIATES,False,5135,Roth Bros; Heating Ventilating and Air Conditioning HVAC; Ventresca Bros
2026-02-16 07:27:43 UTC,285,DEANGELIS DIAMOND CONSTRUCTION,DEANGELIS DIAMOND CONSTRUCTION,False,35035,DeAngelis Iron Works; Design and Engineering; Structural Steel
2026-02-16 07:27:43 UTC,286,TRITON CONSTRUCTION CO. LLC,TRITON CONSTRUCTION,True,34711,Triton Construction Group; General Construction Management; Triton solutions
2026-02-16 07:27:43 UTC,287,SKENDER,SKENDER,True,170,"Skender; Project Management and Coordination; Sender Electric, LLC"
2026-02-16 07:27:43 UTC,288,RODGERS BUILDERS,RODGERS BUILDERS,True,4145,Rodgers Builders; Countertops; Demolition
2026-02-16 07:27:43 UTC,289,LYDIG CONSTRUCTION,LYDIG CONSTRUCTION,True,34654,Lydig Construction; Project Management and Coordination; HTF CONSTRUCTION CONSTRUCTION
2026-02-16 07:27:43 UTC,290,FRANA COS. INC.,FRANA COMPANIES,True,1490,Frana Companies; Finish Carpentry; Rough Carpentry
2026-02-16 07:27:43 UTC,291,PERNIX GROUP INC.,PERNIX GROUP,False,9452,TEMP; GROUP; Architectural Design and Engineering
2026-02-16 07:27:43 UTC,292,SHELCO LLC,SHELCO,True,462,Shelco; Project Management and Coordination; Shelco Construction
2026-02-16 07:27:43 UTC,293,SNYDER LANGSTON,SNYDER LANGSTON,False,117,"office; Snyder Roofing of Washington, LLC; Ceilings"
2026-02-16 07:27:43 UTC,294,MANSON CONSTRUCTION CO.,MANSON CONSTRUCTION,True,34655,Manson Construction; Rough Carpentry; Manson Construction Co.
2026-02-16 07:27:43 UTC,295,C. OVERAA & CO.,C. OVERAA & CO,True,3891,Overaa Construction; C. Overaa & Co; Concrete
2026-02-16 07:27:43 UTC,296,INTECH CONSTRUCTION,INTECH CONSTRUCTION,False,34659,"Intech Fire Protection, Inc.; Electrical; HTF CONSTRUCTION CONSTRUCTION"
2026-02-16 07:27:43 UTC,297,S. T. WOOTEN CORP.,S. T. WOOTEN,False,2212,S and T; Communications; T S I Plumbing
2026-02-16 07:27:43 UTC,298,KRAEMER NORTH AMERICA LLC,KRAEMER NORTH AMERICA,False,4429,"North American Civil; North American Civil Works, LLC; 3d Capture Scanning"
2026-02-16 07:27:43 UTC,299,HARPER CONSTRUCTION CO. INC.,HARPER CONSTRUCTION,False,34693,gary harper construction; Access Flooring; Rulon Harper Construction DBA Harper Precast
2026-02-16 07:27:43 UTC,300,BOWEN ENGINEERING CORP.,BOWEN ENGINEERING,True,6992,Bowen Engineering; Concrete; Earthwork
2026-02-16 07:27:43 UTC,301,COLUMBIA,COLUMBIA,True,365,Columbia; Bim and Model Making Services; General Construction Management
2026-02-16 07:27:43 UTC,302,HARPER GENERAL CONTRACTORS,HARPER GENERAL,True,5081,Harper General Contractor; Plumbing; Harper Electric
2026-02-16 07:27:43 UTC,303,JPI,JPI,False,546,JCI; Fire Suppression; WPI
2026-02-16 07:27:43 UTC,304,MARCH ASSOCIATES CONSTRUCTION INC.,MARCH ASSOCIATES CONSTRUCTION,False,37580,office; March Adams; Design and Engineering
2026-02-16 07:27:43 UTC,305,Q&D CONSTRUCTION,Q&D CONSTRUCTION,False,42,Q electric; Small Business; Electrical
2026-02-16 07:27:43 UTC,306,CLARK CONSTRUCTION CO.,CLARK CONSTRUCTION,True,34846,Clark Construction; Concrete; Project Management and Coordination
2026-02-16 07:27:43 UTC,307,HAWKINS CONSTRUCTION CO.,HAWKINS CONSTRUCTION,True,34694,Hawkins Construction Inc.; Concrete; Demolition
2026-02-16 07:27:43 UTC,308,EXXEL PACIFIC INC.,EXXEL PACIFIC,False,1271,"Exxel Engineering, Inc.; Design and Engineering; Pacific Supply"
2026-02-16 07:27:43 UTC,309,THE BETTE COS.,BETTE,False,384,Bouma Betten; Ceilings; Countertops
2026-02-16 07:27:43 UTC,310,POETTKER CONSTRUCTION CO.,POETTKER CONSTRUCTION,False,34654,HTF CONSTRUCTION CONSTRUCTION; Concrete; Rough Carpentry
2026-02-16 07:27:43 UTC,311,SCHIMENTI CONSTRUCTION CO.,SCHIMENTI CONSTRUCTION,False,34654,HTF CONSTRUCTION CONSTRUCTION; Concrete; Rough Carpentry
2026-02-16 07:27:43 UTC,312,R.D. OLSON CONSTRUCTION,R.D. OLSON CONSTRUCTION,False,36758,R Olson; Concrete; David R Olson
2026-02-16 07:27:43 UTC,313,PIONEER GENERAL CONTRACTORS INC.,PIONEER GENERAL,True,5201,Pioneer General Contractors; Plumbing; Project Management and Coordination
2026-02-16 07:27:43 UTC,314,HUNZINGER CONSTRUCTION CO.,HUNZINGER CONSTRUCTION,True,34655,Hunzinger Construction Company; Bim and Model Making Services; General Construction Management
2026-02-16 07:27:43 UTC,315,JIM COOPER CONSTRUCTION CO. INC.,JIM COOPER CONSTRUCTION,False,34890,Cooper Construction; Project Management and Coordination; Jim
2026-02-16 07:27:43 UTC,316,M. B. KAHN CONSTRUCTION CO. INC.,M. B. KAHN CONSTRUCTION,True,36597,M B Kahn; Project Management and Coordination; office
2026-02-16 07:27:43 UTC,317,BRADBURY STAMM CONSTRUCTION INC.,BRADBURY STAMM CONSTRUCTION,True,34658,Bradbury Stamm Construction; General Construction Management; HTF CONSTRUCTION CONSTRUCTION
2026-02-16 07:27:43 UTC,318,SHOOK CONSTRUCTION,SHOOK CONSTRUCTION,True,34665,Shook Construction; Concrete; Earthwork
2026-02-16 07:27:43 UTC,319,MILLER VALENTINE CONSTRUCTION,MILLER VALENTINE CONSTRUCTION,True,35093,Miller Valentine; Demolition; Rough Carpentry
2026-02-16 07:27:43 UTC,320,PLANT CONSTRUCTION CO. LP,PLANT CONSTRUCTION,False,34798,office; Plant Pros; Landscaping
2026-02-16 07:27:43 UTC,321,CR MEYER,CR MEYER,True,314,CR Meyer; Concrete; Demolition
2026-02-16 07:27:43 UTC,322,DOSTER CONSTRUCTION CO.,DOSTER CONSTRUCTION,True,34655,Doster Construction; General Construction Management; Project Management and Coordination
2026-02-16 07:27:43 UTC,323,THE HAGERMAN GROUP,HAGERMAN GROUP,True,9455,Hagerman Group; Concrete; Masonry
2026-02-16 07:27:43 UTC,324,GARDNER BUILDERS,GARDNER BUILDERS,False,4179,Gardner Company; General Construction Management; Project Management and Coordination
2026-02-16 07:27:43 UTC,325,HILL & WILKINSON GENERAL CONTRACTORS,HILL & WILKINSON GENERAL,False,1964,McClure Hill; Electrical; Hill International
2026-02-16 07:27:43 UTC,326,HOURIGAN,HOURIGAN,True,27,Hourigan; Project Management and Coordination; Hourigan Construction
2026-02-16 07:27:43 UTC,327,DONOHOE CONSTRUCTION CO.,DONOHOE CONSTRUCTION,True,34657,Donohoe Construction; Project Management and Coordination; Donohoe
2026-02-16 07:27:43 UTC,328,ABSHER CONSTRUCTION CO.,ABSHER CONSTRUCTION,True,34654,"Absher Construction Co.; Absher-Stellar J Joint Venture; Front & Market, LLC"
2026-02-16 07:27:43 UTC,329,RIVER CITY CONSTRUCTION LLC,RIVER CITY CONSTRUCTION,True,37255,River City Construction Group; Interior Specialties; River City Builders
2026-02-16 07:27:43 UTC,330,LEOPARDO COS.,LEOPARDO COMPANIES,True,1491,"Leopardo Companies, Inc; Finish Carpentry; General Construction Management"
2026-02-16 07:27:43 UTC,331,T N WARD CO.,T N WARD,True,1845,T N Ward Company; Concrete; Demolition
2026-02-16 07:27:43 UTC,332,DENHAM-BLYTHE CO.,DENHAM-BLYTHE,True,1,Lexington; Louisville; Nashville
2026-02-16 07:27:43 UTC,333,KBE BUILDING CORP.,KBE BUILDING,True,5796,KBE Building Corporation; General Construction Management; KBE Design Build
2026-02-16 07:27:43 UTC,334,MARKET & JOHNSON INC.,MARKET & JOHNSON,False,3179,Taibah Market; Acoustic Ceilings; Market Source
2026-02-16 07:27:43 UTC,335,EXECUTIVE CONSTRUCTION INC.,EXECUTIVE CONSTRUCTION,False,34746,Executive Landscaping; Earthwork; Landscaping
2026-02-16 07:27:43 UTC,336,ALBERT C. KOBAYASHI INC.,ALBERT C. KOBAYASHI,False,1395,Albert Architecture; Albert Lee; Design and Engineering
2026-02-16 07:27:43 UTC,337,FORTUNE-JOHNSON LLC,FORTUNE-JOHNSON,False,0,
2026-02-16 07:27:43 UTC,338,KLINGER COS. LLC,KLINGER,False,201,office; Klinger Masonry Inc.; Masonry
2026-02-16 07:27:43 UTC,339,KBS INC.,KBS,True,559,office; KBS; Abatement and Remediation
2026-02-16 07:27:43 UTC,340,PRIMUS BUILDERS INC.,PRIMUS BUILDERS,False,4117,Primus Surfaces; Countertops; Terrazzo Flooring
2026-02-16 07:27:43 UTC,341,GH PHIPPS CONSTRUCTION COS.,GH PHIPPS CONSTRUCTION,True,34684,office; GH Phipps; Bim and Model Making Services
2026-02-16 07:27:43 UTC,342,TERMINAL CONSTRUCTION CORP.,TERMINAL CONSTRUCTION,True,34669,Terminal Construction; General Construction Management; Terminal Construction Corp.
2026-02-16 07:27:43 UTC,343,WESPAC CONSTRUCTION,WESPAC CONSTRUCTION,False,34656,WESPAC Electrical Contractors Ltd.; Electrical; HTF CONSTRUCTION CONSTRUCTION
2026-02-16 07:27:43 UTC,344,PERLO CONSTRUCTION,PERLO CONSTRUCTION,False,34654,HTF CONSTRUCTION CONSTRUCTION; Concrete; Rough Carpentry
2026-02-16 07:27:43 UTC,345,NEI GENERAL CONTRACTING,NEI GENERAL CONTRACTING,False,9416,J2 Contracting; Demolition; General
2026-02-16 07:27:43 UTC,346,LEE KENNEDY CO.,LEE KENNEDY,False,460,Kennedy Jenks; Project Management and Coordination; Kennedy Glass Partners LLC
2026-02-16 07:27:43 UTC,347,BERGLUND CONSTRUCTION CO.,BERGLUND CONSTRUCTION,True,34656,Berglund Construction; Communications; Concrete
2026-02-16 07:27:43 UTC,348,BUCH CONSTRUCTION,BUCH CONSTRUCTION,True,34655,Carolina; Florida Office; Georgia Office
2026-02-16 07:27:43 UTC,349,THOMPSON TURNER CONSTRUCTION,THOMPSON TURNER CONSTRUCTION,True,35021,Thompson Turner; Communications; Turner Construction 
2026-02-16 07:27:43 UTC,350,BLACH CONSTRUCTION,BLACH CONSTRUCTION,True,34654,Blach Construction; General Construction Management; HTF CONSTRUCTION CONSTRUCTION
2026-02-16 07:27:43 UTC,351,ROGER B. KENNEDY CONSTRUCTION,ROGER B. KENNEDY CONSTRUCTION,False,35687,Roger; Electrical; Roger Langeliers Construction
2026-02-16 07:27:43 UTC,352,MOWERY,MOWERY,False,2993,Mowers concret; Concrete; Mowers concrete
2026-02-16 07:27:43 UTC,353,D.F. CHASE INC.,D.F. CHASE,False,2003,office; F D Pierce Co; Heating Ventilating and Air Conditioning HVAC
2026-02-16 07:27:43 UTC,354,HAYDON BUILDING CORP.,HAYDON BUILDING,False,5799,Haydon Materials; Earthwork; Prevailing Wage
2026-02-16 07:27:43 UTC,355,LANDSOUTH CONSTRUCTION,LANDSOUTH CONSTRUCTION,True,34654,"LandSouth Construction LLC; LandSouth Construction, LLC; HTF CONSTRUCTION CONSTRUCTION"
2026-02-16 07:27:43 UTC,356,PENCE CONTRACTORS,PENCE CONTRACTORS,False,11052,J.H. Pence Co; Project Management and Coordination; Pence Countertops Inc.
2026-02-16 07:27:43 UTC,357,BALDWIN & SHELL CONSTRUCTION CO.,BALDWIN & SHELL CONSTRUCTION,False,71,Baldwin Blinds; Window Treatments; office
2026-02-16 07:27:43 UTC,358,MATT CONSTRUCTION,MATT CONSTRUCTION,False,34680,Matt; Landscaping; Project Management and Coordination
2026-02-16 07:27:43 UTC,359,WILLIAM A RANDOLPH INC.,WILLIAM A RANDOLPH,True,227,"William A. Randolph, Inc.; Project Management and Coordination; Randolph Electrical"
2026-02-16 07:27:43 UTC,360,CF EVANS CONSTRUCTION,CF EVANS CONSTRUCTION,False,34792,CF Construction Services; Concrete; Concrete Countertops
2026-02-16 07:27:43 UTC,361,ROEBBELEN CONTRACTING INC.,ROEBBELEN CONTRACTING,False,6811,Soto;s Contracting; Access Doors and Panels; Acoustic Ceilings
2026-02-16 07:27:43 UTC,362,CCC GROUP INC.,CCC GROUP,True,9468,CCC Group; Concrete; Electrical
2026-02-16 07:27:43 UTC,363,SEVENSON ENVIRONMENTAL,SEVENSON ENVIRONMENTAL,False,2886,Sevenson; Earthwork; Precept Environmental
2026-02-16 07:27:43 UTC,364,CHARLES PERRY PARTNERS INC.,CHARLES PERRY PARTNERS,True,2770,"Charles Perry Partners, Inc.; General Construction Management; Project Management and Coordination"
2026-02-16 07:27:43 UTC,365,RABREN GENERAL CONTRACTORS,RABREN GENERAL,True,5036,RGC Main Office; RGC Birmingham Office; Rabren General Contractors
2026-02-16 07:27:43 UTC,366,WORLEY,WORLEY,True,1138,Worley; Structural Steel; Design and Engineering
2026-02-16 07:27:43 UTC,367,MORLEY BUILDERS,MORLEY BUILDERS,False,4122,Morley; Project Management and Coordination; Morley Roofing
2026-02-16 07:27:43 UTC,368,FONTAINE BROS. INC.,FONTAINE BROS,False,917,Fontaine Landscaping; Landscaping; Fontaine Construction
2026-02-16 07:27:43 UTC,369,BARR & BARR INC.,BARR & BARR,True,436,Barr and Barr; Mechanical Design and Engineering; Project Management and Coordination
2026-02-16 07:27:43 UTC,370,E.W. HOWELL CO. LLC,E.W. HOWELL,False,3439,W E Bowers; Commissioning; Disadvantaged Business
2026-02-16 07:27:43 UTC,371,FORT MYER CONSTRUCTION CORP.,FORT MYER CONSTRUCTION,False,34919,office; O'MAHONY & MYER; Design and Engineering
2026-02-16 07:27:43 UTC,372,RONCELLI INC.,RONCELLI,True,10,Roncelli; General Construction Management; Riccelli Enterprises
2026-02-16 07:27:43 UTC,373,GARCO CONSTRUCTION,GARCO CONSTRUCTION,False,34657,GarCo Inc; Acoustic Ceilings; Board Insulation
2026-02-16 07:27:43 UTC,374,CLARK CONTRACTORS,CLARK CONTRACTORS,False,11272,"Clark Construction Contractor, LLC.; Ceilings; Concrete"
2026-02-16 07:27:43 UTC,375,BRYAN CONSTRUCTION INC.,BRYAN CONSTRUCTION,True,34705,Bryan Construction Inc.; Rough Carpentry; Bryan Flooring
2026-02-16 07:27:43 UTC,376,BH INC.,BH INC,False,113246,BH Estimating; Wood Countertops; Wood Wall Panels
2026-02-16 07:27:43 UTC,377,J.F. BRENNAN CO. INC.,J.F. BRENNAN,False,2182,office; Thomas J Brennan Architects; Bim and Model Making Services
2026-02-16 07:27:43 UTC,378,BURKE CONSTRUCTION GROUP INC.,BURKE CONSTRUCTION,True,34720,Burke Mechanical; Concrete; Demolition
2026-02-16 07:27:43 UTC,379,AHTNA NETIFYE LLC,AHTNA NETIFYE,False,4,"Ahtna; Project Management and Coordination; Ahtna Global, LLC"
