timestamp,rank,original_name,search_term,exact_match,match_count,top_matches
2026-02-16 07:27:43 UTC,380,S. M. WILSON & CO.,S. M. WILSON,False,3576,M S Concrete; Concrete; M S International
2026-02-16 07:27:43 UTC,381,BELL & ASSOCIATES CONSTRUCTION LLC,BELL & ASSOCIATES CONSTRUCTION,False,2237,"Bell; General Construction Management; BELL BCI CO., LLC"
2026-02-16 07:27:43 UTC,382,BYRNE CONSTRUCTION SERVICES,BYRNE CONSTRUCTION,True,34665,Byrne Construction Services; Project Management and Coordination; Byrne Construction
2026-02-16 07:27:43 UTC,383,BUTZ ENTERPRISES INC.,BUTZ ENTERPRISES,False,3625,Miller Enterprise Group/Houston Miller Enterprises; Concrete; Demolition
2026-02-16 07:27:43 UTC,384,W.G. CLARK CONSTRUCTION CO.,W.G. CLARK CONSTRUCTION,False,35903,William W Clark; Earthwork; W W Clark Excavating
2026-02-16 07:27:43 UTC,385,PARRISH CONSTRUCTION GROUP INC.,PARRISH CONSTRUCTION,True,34675,Parrish Construction; Communications; Parrish Excavating
2026-02-16 07:27:43 UTC,386,COAKLEY & WILLIAMS CONSTRUCTION,COAKLEY & WILLIAMS CONSTRUCTION,False,101,Coakley Brothers; Structure and Building Moving Relocation; Coakley Plumbing
2026-02-16 07:27:43 UTC,387,KEY CONSTRUCTION INC.,KEY CONSTRUCTION,True,34958,Key Construction Inc.; Project Management and Coordination; Top Key Construction
2026-02-16 07:27:43 UTC,388,DESCOR BUILDERS,DESCOR BUILDERS,False,4111,Builders; Rough Carpentry; 2B Builders
2026-02-16 07:27:43 UTC,389,GHILOTTI CONSTRUCTION CO.,GHILOTTI CONSTRUCTION,False,34659,"Team Ghilotti; Earthwork; Ghilotti Bros., Inc."
2026-02-16 07:27:43 UTC,390,BUFFALO CONSTRUCTION,BUFFALO CONSTRUCTION,False,34727,office; Buffalo; Communications
2026-02-16 07:27:43 UTC,391,BROWN CONSTRUCTION INC.,BROWN CONSTRUCTION,True,34968,Brown and Brown Construction; Rough Carpentry; Brady Brown Construction
2026-02-16 07:27:43 UTC,392,WILLIAMS INDUSTRIAL SERVICES GROUP INC.,WILLIAMS INDUSTRIAL SERVICES,False,30086,Builder Services Group; Thermal Insulation; Williams Insulation
2026-02-16 07:27:43 UTC,393,BARRY-WEHMILLER DESIGN GROUP,BARRY-WEHMILLER DESIGN,True,10495,Barry Wehmiller Design Group; Architectural Design and Engineering; Electrical
2026-02-16 07:27:43 UTC,394,J.D. ECKMAN INC.,J.D. ECKMAN,False,2928,office; J D; Earthwork
2026-02-16 07:27:43 UTC,395,WAGMAN INC.,WAGMAN CONSTRUCTION,True,34656,Wagman Construction; Ceilings; Concrete
2026-02-16 07:27:43 UTC,396,A.R. MAYS CONSTRUCTION,A.R. MAYS CONSTRUCTION,False,35789,Grover Mays Construction; Structural Steel; Mays concrete
2026-02-16 07:27:43 UTC,397,EAGLE BUILDING CO.,EAGLE BUILDING,True,6245,Eagle Building Company; General Construction Management; Small Business
2026-02-16 07:27:43 UTC,398,KIELY FAMILY OF COS.,KIELY FAMILY,True,2310,Kiely Family of Companies; Concrete; Demolition
2026-02-16 07:27:43 UTC,399,OMNIBUILD,OMNIBUILD,False,0,
2026-02-16 07:27:43 UTC,400,P. AGNES,P. AGNES,False,494,Ages; Heating Ventilating and Air Conditioning HVAC; Project Management and Coordination
